{
  "$schema": "http://json-schema.org/draft-07/schema#",
  "type": "object",
  "title": "Umfrageresultat",
  "properties": {
    "title": {
      "title": "Titel",
      "type": "string",
      "Q:options": {
        "placeholder": "Der Titel bringt die Kernaussage der Umfrageresultate auf den Punkt&#46;"
      }
    },
    "subtitle": {
      "title": "Untertitel",
      "type": "string",
      "Q:options": {
        "placeholder": "Stimmabsichten zur XY-Vorlage"
      }
    },
    "polls": {
      "title": "Umfragen",
      "type": "array",
      "Q:options": {
        "expandable": {
          "itemLabelProperty": "date"
        },
        "notificationChecks": [
          {
            "type": "ToolEndpoint",
            "config": {
              "endpoint": "notification/pollTotalOverOneHundredPercent",
              "fields": ["polls"]
            },
            "priority": {
              "type": "high",
              "value": 0
            }
          }
        ]
      },
      "items": {
        "oneOf": [
          { "$ref": "#/definitions/preVoteNoToYes5" },
          { "$ref": "#/definitions/preVoteNoToYes3" }
        ]
      }
    },
    "notes": {
      "type": "string",
      "title": "Bemerkungen"
    },
    "sources": {
      "type": "array",
      "title": "Quellen",
      "items": {
        "title": "Quelle",
        "type": "object",
        "properties": {
          "text": {
            "title": "Text",
            "type": "string"
          },
          "link": {
            "Q:type": "link",
            "title": "Link",
            "type": "object",
            "Q:options": {
              "placeholder": "Direktlink zur Quelle, http&#53;//&#46;&#46;&#46;"
            },
            "properties": {
              "url": {
                "title": "Url",
                "type": "string"
              },
              "isValid": {
                "type": "boolean"
              }
            }
          }
        },
        "required": ["text"]
      }
    }
  },
  "required": ["title"],
  "definitions": {
    "preVoteNoToYes5": {
      "type": "object",
      "title": "Umfrageergebnis mit 5 Positionen",
      "properties": {
        "type": {
          "type": "string",
          "default": "preVoteNoToYes5",
          "enum": ["preVoteNoToYes5"],
          "Q:options": {
            "hideInEditor": true
          }
        },
        "date": {
          "type": "string",
          "title": "Datum",
          "Q:type": "date"
        },
        "answers": {
          "type": "object",
          "title": "Antworten (in Prozent)",
          "properties": {
            "certain-yes": {
              "type": "number",
              "title": "bestimmt dafür"
            },
            "rather-yes": {
              "type": "number",
              "title": "eher dafür"
            },
            "undecided": {
              "type": "number",
              "title": "weiss nicht"
            },
            "rather-no": {
              "type": "number",
              "title": "eher dagegen"
            },
            "certain-no": {
              "type": "number",
              "title": "bestimmt dagegen"
            }
          }
        }
      },
      "required": ["date"]
    },
    "preVoteNoToYes3": {
      "type": "object",
      "title": "Umfrageergebnis mit 3 Positionen",
      "properties": {
        "type": {
          "type": "string",
          "default": "preVoteNoToYes3",
          "enum": ["preVoteNoToYes3"],
          "Q:options": {
            "hideInEditor": true
          }
        },
        "date": {
          "type": "string",
          "title": "Datum",
          "Q:type": "date"
        },
        "answers": {
          "type": "object",
          "title": "Antworten (in Prozent)",
          "properties": {
            "yes": {
              "type": "number",
              "title": "bestimmt/eher dafür"
            },
            "undecided": {
              "type": "number",
              "title": "weiss nicht"
            },
            "no": {
              "type": "number",
              "title": "bestimmt/eher dagegen"
            }
          }
        }
      },
      "required": ["date"]
    }
  }
}
