{
  "title": "FIXTURE: Stimmabsichten' zur Milchkuh-Initiative",
  "polls": [
    {
      "type": "preVoteNoToYes5",
      "date": "2016-04-29",
      "answers": {
        "certain-yes": 21,
        "rather-yes": 21,
        "undecided": 11,
        "rather-no": 19,
        "certain-no": 28
      }
    },
    {
      "type": "preVoteNoToYes5",
      "date": "2016-05-25",
      "answers": {
        "certain-yes": 22,
        "rather-yes": 18,
        "undecided": 11,
        "rather-no": 17,
        "certain-no": 32
      }
    },
    {
      "type": "preVoteNoToYes3",
      "date": "2016-05-25",
      "answers": {
        "yes": 22,
        "undecided": 11,
        "no": 67
      }
    }
  ],
  "notes": "Bei allen ausgewiesenen Zahlen ist bei einer 95-prozentigen Wahrscheinlichkeit ein statistischer Unsicherheitsbereich von rund 2.7 Prozentpunkten plus/minus mitzudenken (2.9 bei der 1. Umfrage).",
  "sources": [{
    "text": "NZZ Storytelling",
    "link": {
      "url": "https://nzz.ch/storytelling",
      "isValid": true
    }
  }]
}
