{
  "title": "FIXTURE: only 3 positions - one < 100% - not sorted by date",
  "polls": [
    {
      "type": "preVoteNoToYes3",
      "date": "2016-05-25",
      "answers": {
        "yes": 22,
        "undecided": 11,
        "no": 67
      }
    },
    {
      "type": "preVoteNoToYes3",
      "date": "2016-04-29",
      "answers": {
        "yes": 22,
        "undecided": 11,
        "no": 67
      }
    },
    {
      "type": "preVoteNoToYes3",
      "date": "2016-06-25",
      "answers": {
        "yes": 22,
        "undecided": 11,
        "no": 12
      }
    }
  ],
  "notes":
    "Bei allen ausgewiesenen Zahlen ist bei einer 95-prozentigen Wahrscheinlichkeit ein statistischer Unsicherheitsbereich von rund 2.7 Prozentpunkten plus/minus mitzudenken (2.9 bei der 1. Umfrage).",
  "sources": [
    {
      "text": "NZZ Storytelling",
      "link": {
        "url": "https://nzz.ch/storytelling",
        "isValid": true
      }
    }
  ]
}
